RTK,M,--,South East,Ashford & St Peter's Hospitals,2,0,1,0,0,1,4,0,1,1,0,0,1,ASHFORD AND ST PETER'S HOSPITALS NHS TRUST,Y52,Q37,ST PETERS HOSPITAL,GUILDFORD ROAD,,CHERTSEY,SURREY,KT16 0PZ,19980401
RTP,M,--,South East,Surrey & Sussex Healthcare,2,2,3,0,1,1,1,0,3,0,1,3,2,SURREY AND SUSSEX HEALTHCARE NHS TRUST,Y52,Q37,EAST SURREY HOSPITAL,CANADA AVENUE,,REDHILL,SURREY,RH1 5RH,19980401
RTR,L,FT,North East,South Tees Hospitals,0,0,0,0,1,1,0,1,0,3,3,1,3,SOUTH TEES HOSPITALS NHS FOUNDATION TRUST,Y51,Q30,JAMES COOK UNIVERSITY HOSPITAL,MARTON ROAD,,MIDDLESBROUGH,CLEVELAND,TS4 3BW,20020401
RTX,L,--,North West,University Hospitals of Morecambe Bay,1,2,1,2,0,0,3,0,1,1,0,1,1,UNIVERSITY HOSPITALS OF MORECAMBE BAY NHS TRUST,Y51,Q31,WESTMORLAND GENERAL HOSPITAL,BURTON ROAD,,KENDAL,CUMBRIA,LA9 7RG,19980401
RV8,L,--,London,North West London Hospitals,1,2,0,1,2,0,3,1,0,1,3,3,0,NORTH WEST LONDON HOSPITALS NHS TRUST,Y53,Q36,NORTHWICK PARK HOSPITAL,WATFORD ROAD,,HARROW,MIDDLESEX,HA1 3UJ,19990401
RVJ,L,--,South West,North Bristol,1,4,1,4,4,6,3,2,3,2,3,0,3,NORTH BRISTOL NHS TRUST,Y52,Q39,FRENCHAY HOSPITAL,BECKSPOOL ROAD,FRENCHAY,BRISTOL,AVON,BS16 1JE,19990401
RVL,L,--,London,Barnet & Chase Farm Hospitals,1,2,1,0,3,1,2,2,0,1,1,3,0,BARNET AND CHASE FARM HOSPITALS NHS TRUST,Y53,Q36,BARNET GENERAL HOSPITAL,WELLHOUSE LANE,,BARNET,HERTFORDSHIRE,EN5 3DJ,19990401
RVR,L,--,London,Epsom & St Helier University Hospitals,1,6,0,2,1,4,3,2,2,3,4,2,2,EPSOM AND ST HELIER UNIVERSITY HOSPITALS NHS TRUST,Y53,Q36,ST HELIER HOSPITAL,WRYTHE LANE,,CARSHALTON,SURREY,SM5 1AA,19990401
RVV,L,FT,South East,East Kent Hospitals University,3,1,2,1,2,1,3,0,0,2,0,2,1,EAST KENT HOSPITALS UNIVERSITY NHS FOUNDATION TRUST,Y52,Q37,KENT & CANTERBURY HOSPITAL,ETHELBERT ROAD,,CANTERBURY,KENT,CT1 3NG,19990401
RVW,M,FT,North East,North Tees & Hartlepool,0,0,4,1,0,1,3,0,0,1,1,0,0,NORTH TEES AND HARTLEPOOL NHS FOUNDATION TRUST,Y51,Q30,UNIVERSITY HOSPITAL OF HARTLEPOOL,HOLDFORTH ROAD,,HARTLEPOOL,CLEVELAND,TS24 9AH,19990401
RVY,M,--,North West,Southport & Ormskirk Hospital,1,1,1,2,1,0,1,1,2,1,2,0,0,SOUTHPORT AND ORMSKIRK HOSPITAL NHS TRUST,Y51,Q31,TOWN LANE,,,SOUTHPORT,MERSEYSIDE,PR8 6PN,19990401
RW3,T,FT,North West,Central Manchester University Hospitals,0,0,0,0,0,1,0,1,2,0,1,2,1,CENTRAL MANCHESTER UNIVERSITY HOSPITALS NHS FOUNDATION TRUST,Y51,Q31,"TRUST HEADQUARTERS, COBBETT HOUSE",MANCHESTER ROYAL INFIRMARY,OXFORD ROAD,MANCHESTER,GREATER MANCHESTER,M13 9WL,20010401
RW6,L,--,North West,Pennine Acute Hospitals,2,3,1,4,4,1,3,3,1,3,4,3,6,PENNINE ACUTE HOSPITALS NHS TRUST,Y51,Q31,TRUST HEADQUARTERS,NORTH MANCHESTER GENERAL HOSPITAL,"DELAUNAYS ROAD, CRUMPSALL",MANCHESTER,GREATER MANCHESTER,M8 5RB,20020401
RWA,L,--,Yorkshire & the Humber,Hull & East Yorkshire Hospitals,5,4,2,4,1,0,2,2,3,1,3,2,3,HULL AND EAST YORKSHIRE HOSPITALS NHS TRUST,Y51,Q32,HULL ROYAL INFIRMARY,ANLABY ROAD,,HULL,EAST YORKSHIRE,HU3 2JZ,19991001
RWD,L,--,East Midlands,United Lincolnshire Hospitals,0,4,0,4,0,1,2,2,2,2,3,1,2,UNITED LINCOLNSHIRE HOSPITALS NHS TRUST,Y51,Q33,LINCOLN COUNTY HOSPITAL,GREETWELL ROAD,,LINCOLN,LINCOLNSHIRE,LN2 4AX,20000401
RWE,T,--,East Midlands,University Hospitals of Leicester,2,1,1,3,2,1,0,0,0,4,2,4,1,UNIVERSITY HOSPITALS OF LEICESTER NHS TRUST,Y51,Q33,GWENDOLEN HOUSE,GWENDOLEN ROAD,,LEICESTER,LEICESTERSHIRE,LE5 4QF,20000401
RWF,L,--,South East,Maidstone & Tunbridge Wells,1,0,1,2,2,1,1,3,3,2,3,2,3,MAIDSTONE AND TUNBRIDGE WELLS NHS TRUST,Y52,Q37,MAIDSTONE HOSPITAL,HERMITAGE LANE,,MAIDSTONE,KENT,ME16 9QQ,20000401
RWG,L,--,East of England,West Hertfordshire Hospitals,2,0,2,0,0,0,2,0,0,2,0,0,1,WEST HERTFORDSHIRE HOSPITALS NHS TRUST,Y51,Q35,TRUST OFFICES,HEMEL HEMPSTEAD GENERAL HOSPITAL,HILLFIELD ROAD,HEMEL HEMPSTEAD,HERTFORDSHIRE,HP2 4AD,20000401
RWH,L,--,East of England,East & North Hertfordshire,2,1,0,0,1,0,1,1,2,1,2,0,1,EAST AND NORTH HERTFORDSHIRE NHS TRUST,Y51,Q35,LISTER HOSPITAL,COREYS MILL LANE,,STEVENAGE,HERTFORDSHIRE,SG1 4AB,20000401
RWJ,M,FT,North West,Stockport,2,0,2,1,0,0,0,0,0,0,2,1,0,STOCKPORT NHS FOUNDATION TRUST,Y51,Q31,STEPPING HILL HOSPITAL,POPLAR GROVE,,STOCKPORT,CHESHIRE,SK2 7JE,20000401
RWP,L,--,West Midlands,Worcestershire Acute Hospitals,0,3,1,1,0,1,1,0,0,0,0,1,0,WORCESTERSHIRE ACUTE HOSPITALS NHS TRUST,Y51,Q34,WORCESTERSHIRE ROYAL HOSPITAL,CHARLES HASTINGS WAY,,WORCESTER,WORCESTERSHIRE,WR5 1DD,20000401
RWW,M,FT,North West,Warrington & Halton Hospitals,0,0,0,2,1,1,1,0,0,1,1,0,1,WARRINGTON AND HALTON HOSPITALS NHS FOUNDATION TRUST,Y51,Q31,WARRINGTON HOSPITAL,LOVELY LANE,,WARRINGTON,CHESHIRE,WA5 1QG,20010401
RWY,L,FT,Yorkshire & the Humber,Calderdale & Huddersfield,2,0,2,1,2,2,0,1,0,3,2,1,2,CALDERDALE AND HUDDERSFIELD NHS FOUNDATION TRUST,Y51,Q32,ROYAL INFIRMARY,ACRE STREET,,HUDDERSFIELD,WEST YORKSHIRE,HD3 3EA,20010401
RX1,T,--,East Midlands,Nottingham University Hospitals,5,5,9,6,1,0,2,3,3,4,1,4,2,NOTTINGHAM UNIVERSITY HOSPITALS NHS TRUST,Y51,Q33,TRUST HEADQUARTERS,QMC CAMPUS,DERBY ROAD,NOTTINGHAM,NOTTINGHAMSHIRE,NG7 2UH,20060401
RXC,L,--,South East,East Sussex Hospitals,1,2,0,0,0,3,1,2,0,0,0,0,0,EAST SUSSEX HOSPITALS NHS TRUST,Y52,Q37,ST. ANNES HOUSE,729 THE RIDGE,,ST. LEONARDS-ON-SEA,EAST SUSSEX,TN37 7PT,20020401
RXF,L,--,Yorkshire & the Humber,Mid Yorkshire Hospitals,6,3,1,4,2,1,1,1,2,2,8,3,4,MID YORKSHIRE HOSPITALS NHS TRUST,Y51,Q32,ROWAN HOUSE,ABERFORD ROAD,,WAKEFIELD,WEST YORKSHIRE,WF1 4EE,20020401
RXH,T,--,South East,Brighton & Sussex University Hospitals,6,4,3,3,2,3,2,2,1,1,1,3,2,BRIGHTON AND SUSSEX UNIVERSITY HOSPITALS NHS TRUST,Y52,Q37,ROYAL SUSSEX COUNTY HOSPITAL,EASTERN ROAD,,BRIGHTON,EAST SUSSEX,BN2 5BE,20020401
RXK,L,--,West Midlands,Sandwell & West Birmingham Hospitals,2,2,1,2,1,0,1,1,2,0,1,2,1,SANDWELL AND WEST BIRMINGHAM HOSPITALS NHS TRUST,Y51,Q34,CITY HOSPITAL,DUDLEY ROAD,,BIRMINGHAM,WEST MIDLANDS,B18 7QH,20020401
RXL,L,FT,North West,"Blackpool, Fylde & Wyre Hospitals",1,1,0,1,0,0,1,1,1,0,1,1,1,"BLACKPOOL, FYLDE AND WYRE HOSPITALS NHS FOUNDATION TRUST",Y51,Q31,VICTORIA HOSPITAL,WHINNEY HEYS ROAD,,BLACKPOOL,LANCASHIRE,FY3 8NR,20020401
RXN,L,FT,North West,Lancashire Teaching Hospitals,3,0,0,3,0,2,0,2,1,0,4,1,1,LANCASHIRE TEACHING HOSPITALS NHS FOUNDATION TRUST,Y51,Q31,CHIEF EXECUTIVE'S OFFICE,ROYAL PRESTON HOSPITAL,"SHAROE GREEN LANE, FULWOOD",PRESTON,LANCASHIRE,PR2 9HT,20020801
RXP,L,FT,North East,County Durham & Darlington,2,0,1,0,2,0,0,1,2,1,0,0,0,COUNTY DURHAM AND DARLINGTON NHS FOUNDATION TRUST,Y51,Q30,DARLINGTON MEMORIAL HOSPITAL,HOLLYHURST ROAD,,DARLINGTON,COUNTY DURHAM,DL3 6HX,20021001
RXQ,M,--,South East,Buckinghamshire Hospitals,0,0,1,0,0,6,1,1,1,1,0,0,1,BUCKINGHAMSHIRE HOSPITALS NHS TRUST,Y52,Q38,AMERSHAM HOSPITAL,WHIELDEN STREET,,AMERSHAM,BUCKINGHAMSHIRE,HP7 0JD,20030401
RXR,L,--,North West,East Lancashire Hospitals,4,1,3,4,1,1,3,2,1,1,0,1,0,EAST LANCASHIRE HOSPITALS NHS TRUST,Y51,Q31,ROYAL BLACKBURN HOSPITAL,HASLINGDEN ROAD,,BLACKBURN,LANCASHIRE,BB2 3HH,20030401
RXW,L,--,West Midlands,Shrewsbury & Telford Hospital,0,1,1,0,0,3,0,1,1,2,0,2,0,SHREWSBURY AND TELFORD HOSPITAL NHS TRUST,Y51,Q34,MYTTON OAK ROAD,,,SHREWSBURY,SHROPSHIRE,SY3 8XQ,20031001
RYJ,T,--,London,Imperial College Healthcare,5,2,3,3,2,4,2,5,0,7,5,2,2,IMPERIAL COLLEGE HEALTHCARE NHS TRUST,Y53,Q36,ST. MARYS HOSPITAL,PRAED STREET,,LONDON,GREATER LONDON,W2 1NY,20071001
RYQ,L,--,London,South London Healthcare,0,1,1,2,1,1,3,1,1,2,2,0,1,SOUTH LONDON HEALTHCARE NHS TRUST,Y53,Q36,QUEEN MARY'S HOSPITAL,FROGNAL AVENUE,,SIDCUP,KENT,DA14 6LT,20090401
RYR,M,--,South East,Western Sussex Hospitals,2,4,3,1,1,3,1,0,1,2,2,1,1,WESTERN SUSSEX HOSPITALS NHS TRUST,Y52,Q37,WORTHING HOSPITAL,LYNDHURST ROAD,,WORTHING,WEST SUSSEX,BN11 2DH,20090401
